Kategori,Şehir,İlçe,Firma Adı,Adres,Açıklama,Telefon,E-posta,Web Sitesi,Enlem,Boylam
Guzellik-Salonlari-Ve-Merkezleri,Istanbul,Kadikoy,Dermaline- Koby Teksti̇l Turi̇zm San.Ti̇c.Ltd.Şti̇.,"Sahrayı Cedit Mah. Atatürk Cad. 33 D:3 Kadıköy, İstanbul",Yok,2164115455,veri yok,veri yok,40.981517,29.084029
Guzellik-Salonlari-Ve-Merkezleri,Istanbul,Kadikoy,Nursun Esteti̇k Merkezi̇,"Caferağa Mah. Moda Cad. 63 Kuğu Gölü Apt. D:2 Kadıköy, İstanbul",Yok,2164145591,veri yok,veri yok,40.986725,29.025856
Guzellik-Salonlari-Ve-Merkezleri,Istanbul,Kadikoy,Beauty Land Güzelli̇k Merkezi̇- Moda Sağlik Hi̇zmetleri̇ Turi̇zm İnşaat Ve Diş Ti̇c.Ltd.Şti̇.,"Caferağa Mah. Mühürdar Cad. 107 Kadıköy, İstanbul",Yok,2164140986,info@beautyland.com.tr,http://www.beautyland.com.tr,40.985951,29.021534
Guzellik-Salonlari-Ve-Merkezleri,Istanbul,Kadikoy,Doreen Estetic- Doreen Estetic Ltd.Şti̇. (Funda Özbeyler),"Süadiye Mah. Emin Alipaşa Cad. 21 Kadıköy, İstanbul",Yok,2164091400,doreenestetic@gmail.com,http://www.doreenestetic.com,40.963079,29.085335
Guzellik-Salonlari-Ve-Merkezleri,Istanbul,Kadikoy,Saloon Black- Les Kuaför Ve Güzelli̇k Hi̇zmetleri̇ Turi̇zm İnşaat Ti̇c.Ltd.Şti̇.,"Sahrayı Cedit Mah. Atatürk Cad. 6/B Özmen Apt. Kadıköy, İstanbul",Yok,2163863940,veri yok,veri yok,40.980685,29.078334
Guzellik-Salonlari-Ve-Merkezleri,Istanbul,Kadikoy,Mellezza Güzelli̇k Salonu(Haçça Dağ),"Süadiye Mah. Kazım Özalp Sok. 20 Kadıköy, İstanbul",Yok,2163630826,veri yok,veri yok,40.96328,29.076833
Guzellik-Salonlari-Ve-Merkezleri,Istanbul,Kadikoy,Studio Creme Brulee(Karine Amatuni),"Süadiye Mah. Yazanlar Sok. 5 Kadıköy, İstanbul",Yok,2165044415,studiocremebrulee@gmail.com,veri yok,40.959747,29.079992
Guzellik-Salonlari-Ve-Merkezleri,Istanbul,Kadikoy,Güler Güzelli̇k Salonu(Güler Güzel Özkan),"19 Mayıs Mah. İnönü Cad. 44 Kartal Apt. Dk:1 Kozyatağı, Kadıköy, İstanbul",Cilt Bakımı Ve Lazer Epilasyon Hizmetleri,2163563118,gulerr.guzellik@comail.com,veri yok,40.978687,29.091702
Guzellik-Salonlari-Ve-Merkezleri,Istanbul,Kadikoy,Emsal Doğan Protez Tirnak,"Süadiye Mah. Bağdat Cad. 369 Kadıköy, İstanbul",Yok,2163504571,veri yok,http://www.proteztirnak.com,40.963061,29.076117
Guzellik-Salonlari-Ve-Merkezleri,Istanbul,Kadikoy,Royal Kozmeti̇k Ve Güzelli̇k Eği̇ti̇mi̇ Merkezi̇- Ab Ortadoğu Eği̇ti̇m Hi̇zmetleri̇ San. Ve Diş Ti̇c.Ltd.Şti̇.,"Feneryolu Mah. Bağdat Cad. 131/104 Kadıköy, İstanbul",Yok,2163375505,veri yok,veri yok,40.977825,29.047771
Guzellik-Salonlari-Ve-Merkezleri,Istanbul,Kadikoy,Nail Stil Protez Tirnak Merkezi̇(Tülin Mutlu),"Bostancı Mah. Emin Ali Paşa Cad. Dar Yol Sok. 19/A Kadıköy, İstanbul",Yok,8503770061,nailstilsuadiye@gmail.com,http://www.nailstil.com,40.959583,29.092796
Guzellik-Salonlari-Ve-Merkezleri,Istanbul,Kadikoy,Di̇ri̇ Ensti̇tü- Di̇ri̇ Kozmeti̇k İthalat İhracat Ltd.Şti̇.,"Caferağa Mah. Dr. Esat Işık Cad. 43/A Kadıköy, İstanbul",Yok,2163497183,diriguzellik@gmail.com,veri yok,40.983932,29.028111
Guzellik-Salonlari-Ve-Merkezleri,Istanbul,Kadikoy,M&M Esthetic Center(Dursane Eyitaş),"Zühtüpaşa Mah. Itri Dede Sok. 39 Çiçek Apt. D:1 Kadıköy, İstanbul",Yok,2163468528,veri yok,veri yok,40.982716,29.036762
Guzellik-Salonlari-Ve-Merkezleri,Istanbul,Kadikoy,Seli̇n Beauty Center Göztepe Şubesi̇,"Merdivenköy Mah. Fahrettin Kerim Gökay Cad. 267/1A Fikret Bey Apt. Kadıköy, İstanbul",Yok,5335056339,selinbeautycentergoztepe@gmail.com,http://selinbeautycenter.com.tr,40.98101,29.073605
Guzellik-Salonlari-Ve-Merkezleri,Istanbul,Kadikoy,Ayşen Di̇kmen Güzelli̇k Salonu(Sina Dikmen Malatya),"Fenerbahçe Mah. Hasan Ali Yücel Sok. 33 Murat Apt. D:3 Kadıköy, İstanbul",Yok,2163683579,aysendikmen9@gmail.com,http://www.aysendikmen.com,40.973216,29.055141
Guzellik-Salonlari-Ve-Merkezleri,Istanbul,Kadikoy,Seyfullah Şengül Güzelli̇k Merkezleri̇ Koşuyolu Şubesi̇- Seyfullah Şengül Güzelli̇k Merkezleri̇ Ve Ti̇c.Ltd.Şti̇.,"Koşuyolu Mah. Mehmet Akfan Sok. 35 Imtercontor Blok D:1 Kadıköy, İstanbul",Cilt Bakımı - Kalıcı Makyaj - Lazer Epilasyon Ve Protez Tırnak Hizmeti,2163256961,veri yok,veri yok,41.00879,29.040151
Guzellik-Salonlari-Ve-Merkezleri,Istanbul,Kadikoy,Betül Acar Güzelli̇k Merkezi̇(Zeynep Betül Acar),"Kozyatağı Mah. Bayar Cad. 107 Kadıköy, İstanbul",Yok,2163733921,acar.betul@hotmail.com,veri yok,40.971045,29.099712
Guzellik-Salonlari-Ve-Merkezleri,Istanbul,Kadikoy,Lotus Güzelli̇k Salonu(Rukiye Taş),"Kozyatağı Mah. Kaya Sultan Sok. 26/E Kadıköy, İstanbul",Yok,2163848212,veri yok,veri yok,40.966079,29.091551
Guzellik-Salonlari-Ve-Merkezleri,Istanbul,Kadikoy,Mi̇moza Güzelli̇k Merkezi̇(Muzaffer Akkabak),"Sahrayı Cedit Mah. Kireçhaneler Sok. 2 Kadıköy, İstanbul",Yok,2163020503,veri yok,veri yok,40.982369,29.086151
Guzellik-Salonlari-Ve-Merkezleri,Istanbul,Kadikoy,Bi̇rgül Altuntürk Esteti̇k(Birgül Altuntürk),"Bostancı Mah. Bağdat Cad. 448 D:3 Kadıköy, İstanbul",Yok,2163800222,dr@birgulaltunturk.com,http://birgulaltunturk.com,40.957915,29.084901
Guzellik-Salonlari-Ve-Merkezleri,Istanbul,Kadikoy,Türkan Güzelli̇k Salonu(Yalçın Sünbül),"19 Mayıs Mah. Güneşli Sok. 2/C Erenköy, Kadıköy, İstanbul",Yok,2163554233,veri yok,veri yok,40.970276,29.085123
Guzellik-Salonlari-Ve-Merkezleri,Istanbul,Kadikoy,İlker Yavrutürk Hair Creative- İlker Yavrutürk Güzelli̇k Hi̇zmetleri̇ Ltd.Şti̇. (İlker Yavrutürk),"Göztepe Mah. Bağdat Cad. 311 K:1 D:1 Kadıköy, İstanbul",Yok,2163020437,veri yok,veri yok,40.966499,29.069713
Guzellik-Salonlari-Ve-Merkezleri,Istanbul,Kadikoy,Bi̇ori̇tm Güzelli̇k Merkezi̇ Erenköy Şubesi̇- Bi̇ori̇tm Sağlik Hi̇zmetleri̇ Ve Kozmeti̇k Ürünleri̇ San.Ti̇c.Ltd.Şti̇.,"Caddebostan Mah. Bağdat Cad. 323/6 Kadıköy, İstanbul",Yok,2163600541,veri yok,http://www.bioritm.com.tr,40.965658,29.071483
Guzellik-Salonlari-Ve-Merkezleri,Istanbul,Kadikoy,Meli̇ssi̇ma Şaşkinbakkal Şubesi̇- Cofiel Güzelli̇k Ve Bakim Hi̇zmetleri̇ A.Ş.,"Caddebostan Mah. Bağdat Cad. 341/B Kadıköy, İstanbul",Cilt Bakımı Hizmeti,8508002008,info@melissima.com.tr,http://melissima.com.tr,40.964401,29.073495
Guzellik-Salonlari-Ve-Merkezleri,Istanbul,Kadikoy,Beauty Land(Mustafa Hakan Burak),"Caferağa Mah. Mühürdar Karakolu Sok. 107 Kadıköy, İstanbul",Yok,2164147950,veri yok,veri yok,40.985012,29.02339
Guzellik-Salonlari-Ve-Merkezleri,Istanbul,Kadikoy,Lotus Beauty Club(Nilüfer Olgun),"Caddebostan Mah. Bağdat Cad. 284 Canoğlu Apt. Kadıköy, İstanbul",Lazer Epilasyon Ve Zayıflama Merkezi,2163639354,veri yok,veri yok,40.968709,29.064544
Guzellik-Salonlari-Ve-Merkezleri,Istanbul,Kadikoy,Köşk Lazer Güzelli̇k Ve Esteti̇k Hi̇zmetleri̇- Köşk Lazer Güzelli̇k Ve Esteti̇k Sağlik Ltd.Şti̇.,"Göztepe Mah. 13 Mart Şehitleri Sok. 4 Kadıköy, İstanbul",Yok,2166021604,veri yok,veri yok,40.981416,29.067194
Guzellik-Salonlari-Ve-Merkezleri,Istanbul,Kadikoy,Fi̇ruze Güzelli̇k Salonu(Fatma Çarmıklı),"Kozyatağı Mah. Korkut Sok. 21/C Serdar Bey Apt. Erenköy, Kadıköy, İstanbul",Yok,2164109699,veri yok,veri yok,40.96754,29.096651
Guzellik-Salonlari-Ve-Merkezleri,Istanbul,Kadikoy,Mesomed- Atalay Özel Sağlik İşletmeleri̇ Ti̇c.Ltd.Şti̇.,"Caferağa Mah. Serasker Cad. 106 Zambak Apt. Kadıköy, İstanbul",Yok,2164188183,veri yok,veri yok,40.989437,29.02784
Guzellik-Salonlari-Ve-Merkezleri,Istanbul,Kadikoy,Dedi̇kodu Bayan Kuaför Ve Güzelli̇k Merkezi̇(Sibel Ballı),"Caferağa Mah. Şair Nefi Sok. 4 Kadıköy, İstanbul",Yok,2164180090,veri yok,veri yok,40.984258,29.026737
Guzellik-Salonlari-Ve-Merkezleri,Istanbul,Kadikoy,Sunrise Beauty Club- Sunrise Ltd.Şti̇. (Filiz Orbak),"Göztepe Mah. Tütüncü Mehmet Efendi Cad. 96 Tepe Apt. D:6 Kadıköy, İstanbul",Yok,2164784141,veri yok,http://www.sunrisebeautyclub.com,40.98056,29.06796
Guzellik-Salonlari-Ve-Merkezleri,Istanbul,Kadikoy,Eva El Ayak Salonu(Hatice Alagöz),"19 Mayıs Mah. Bayar Cad. 23 Kadıköy, İstanbul",El Ve Ayak Bakım Salonu,2163689527,veri yok,veri yok,40.977194099594,29.087322813486
Guzellik-Salonlari-Ve-Merkezleri,Istanbul,Kadikoy,Sapphire Güzelli̇k Merkezi̇- Kadiköy Güzelli̇k Merkezi̇ Ti̇c.Ltd.Şti̇.,"Eğitim Mah. Poyraz Sok. 9 Kadıköy, İstanbul",Yok,2165508929,veri yok,veri yok,40.991814,29.040685
Guzellik-Salonlari-Ve-Merkezleri,Istanbul,Kadikoy,Myramed Esteti̇k Ve Güzelli̇k,"Süadiye Mah. Öğretmen Hayrullah Sok. 4/C Kadıköy, İstanbul",Yok,5413493176,info@myramed.com,http://www.myramed.com,40.961657378416,29.089816863612
Guzellik-Salonlari-Ve-Merkezleri,Istanbul,Kadikoy,Lamazi̇ Medi̇kal(Gülsüm Çağıl Osanmaz),"Göztepe Mah. Dr. Fazıl Gökçe Ören Sok. 4/A Kadıköy, İstanbul",Yok,2165665665,veri yok,veri yok,40.982452,29.060891
Guzellik-Salonlari-Ve-Merkezleri,Istanbul,Kadikoy,Şeri̇ Bi̇rsen Güzelli̇k Salonu(Bayram Yıldırım),"Göztepe Mah. Mustafa Mazhar Bey Cad. Evsan Sok. 19/1 Evim Apt. Kadıköy, İstanbul",Yok,2165669338,veri yok,veri yok,40.981196,29.060568
Guzellik-Salonlari-Ve-Merkezleri,Istanbul,Kadikoy,3 To Ayak Bakim Merkezi̇- 3 To Ayak Bakim Teksti̇l İthalat İhracat San. Ve Ti̇c.Ltd.Şti̇.,"Süadiye Mah. Bağdat Cad. 4 Kadıköy, İstanbul",Ayak Bakım Merkezi,2163634701,veri yok,veri yok,40.98632,29.038545
Guzellik-Salonlari-Ve-Merkezleri,Istanbul,Kadikoy,Metacare Beauty(Dicle Zengin),"Sahrayı Cedit Mah. Halk Sok. 34/A Betakent Sit. 1B Blok Kadıköy, İstanbul",Yok,5013608284,dicle.zengin08@gmail.com,veri yok,40.983602,29.089642
Guzellik-Salonlari-Ve-Merkezleri,Istanbul,Kadikoy,Gülçi̇n Deni̇z Güzelli̇k Merkezi̇(Gülçin Deniz),"Sahrayı Cedit Mah. İnönü Cad. 3 Gül Apt. K:3 D:8 Kadıköy, İstanbul",Yok,2164783953,veri yok,veri yok,40.98032,29.078032
Guzellik-Salonlari-Ve-Merkezleri,Istanbul,Kadikoy,Ezgi̇ Güzelli̇k Salonu(Sebahat Alkan),"Göztepe Mah. İzzet Beltan Sok. Kadıköy, İstanbul",Yok,2165675382,veri yok,veri yok,40.982135,29.059848
Guzellik-Salonlari-Ve-Merkezleri,Istanbul,Kadikoy,Dream Day Spa(Serpil Mısır),"Süadiye Mah. Bağdat Cad. 5 Kadıköy, İstanbul",Yok,2164670770,veri yok,veri yok,40.98773,29.038424
Guzellik-Salonlari-Ve-Merkezleri,Istanbul,Kadikoy,Gül Güzelli̇k Salonu,"19 Mayıs Mah. Tepegöz Sok. 2 Kadıköy, İstanbul",Yok,2163859440,veri yok,veri yok,40.974183,29.055861
Guzellik-Salonlari-Ve-Merkezleri,Istanbul,Kadikoy,Estenbul Beauty For Men,"Caferağa Mah. General Asım Gündüz Cad. 72 Adliye Palas Apt. Kadıköy, İstanbul",Yok,5527975687,estenbul@estenbul.com,http://www.estenbul.com,40.986833,29.028152
Guzellik-Salonlari-Ve-Merkezleri,Istanbul,Kadikoy,Estanbul Plasti̇k Cerrahi̇- Şenel Plasti̇k Cerrahi̇ Sağlik Danişmanlik Hi̇zmetleri̇ Ltd.Şti̇.,"Bostancı Mah. Bağdat Cad. 450 Mine Apt. K:2 D:1-2 Kadıköy, İstanbul",Estetik Merkezleri,2164640001,ozelestanbulpoliklinigi@gmail.com,http://www.ozelestanbulpoliklinigi.com,40.95799375,29.08547675
Guzellik-Salonlari-Ve-Merkezleri,Istanbul,Kadikoy,Salon City(Sevtap Memnune Bıyıklı),"Süadiye Mah. Ayşe Çavuş Cad. 19 Kadıköy, İstanbul",Yok,2163848315,saloncity@hotmail.com,veri yok,40.962009,29.084481
Guzellik-Salonlari-Ve-Merkezleri,Istanbul,Kadikoy,Saloons Güzelli̇k Ve Solaryum Salonu(Sinan Kurtdede),"Kozyatağı Mah. Hilmi Paşa Cad. 37/B Beyaz Saray Apt. Kadıköy, İstanbul",Yok,2163724578,saloonsguzellik@hotmail.com,http://www.saloonsguzellik.com,40.973198,29.09415
Guzellik-Salonlari-Ve-Merkezleri,Istanbul,Kadikoy,Suzan Güzelli̇k Salonu(Suzan Cem),"Hilmi Bey Sok. Esen Apt. Kuyubaşı, Kadıköy, İstanbul",Yok,2165419577,veri yok,veri yok,40.987918,29.047121
Guzellik-Salonlari-Ve-Merkezleri,Istanbul,Kadikoy,Irmak Güzelli̇k Salonu(Hamide Eyibil),"Feneryolu Mah. Mazhar Osman Sok. Kadıköy, İstanbul",Yok,2163456452,veri yok,veri yok,40.981123,29.049812
Guzellik-Salonlari-Ve-Merkezleri,Istanbul,Kadikoy,İnci̇ Güzelli̇k Merkezi̇(İnci Çalgın),"Caddebostan Mah. Plaj Yolu Sok. 1 Kadıköy, İstanbul",Yok,2163867676,veri yok,veri yok,40.968715,29.0642
Guzellik-Salonlari-Ve-Merkezleri,Istanbul,Kadikoy,Black Magi̇c Tattoo(Burak Demir),"Caferağa Mah. Kadife Sok. 1/4 Kadıköy, İstanbul",Yok,2164502307,veri yok,veri yok,40.987177,29.02698
Guzellik-Salonlari-Ve-Merkezleri,Istanbul,Kadikoy,Papatya Güzelli̇k Salonu,"Sahrayı Cedit Mah. Osman Nuri Ergin Sok. 6 Kadıköy, İstanbul",Yok,2164119842,veri yok,veri yok,40.982467,29.083996
Guzellik-Salonlari-Ve-Merkezleri,Istanbul,Kadikoy,Dodem Güzelli̇k Salonu(Bercis Kanıpak),"Göztepe Mah. Cezmi Or Sok. 2/E Kadıköy, İstanbul",Yok,2164118422,veri yok,veri yok,40.975325,29.059473
Guzellik-Salonlari-Ve-Merkezleri,Istanbul,Kadikoy,Gi̇zem Güzelli̇k Salonu,"Kozyatağı Mah. Kaymakam Kemal Sok. 6 Kadıköy, İstanbul",Yok,5325455161,veri yok,veri yok,40.963103,29.095852
Guzellik-Salonlari-Ve-Merkezleri,Istanbul,Kadikoy,Lori̇n Güzelli̇k Salonu(Halis Zengin),"Süadiye Mah. Emin Alipaşa Cad. 62/B Kadıköy, İstanbul",Yok,5353827866,veri yok,veri yok,40.960222,29.090647
Guzellik-Salonlari-Ve-Merkezleri,Istanbul,Kadikoy,Okşans Güzelli̇k Yaşam Akademi̇- Fiçicilar Mi̇marlik Mühendi̇sli̇k İnşaat Otomoti̇v Mobi̇lya Turi̇zm Teksti̇l San. Ve Ti̇c.Ltd.Şti̇.,"Koşuyolu Mah. Katip Salih Sok. 9 Kadıköy, İstanbul",Yok,5354748267,veri yok,veri yok,41.011519,29.036106
Guzellik-Salonlari-Ve-Merkezleri,Istanbul,Kadikoy,Necla Güzelli̇k Merkezi̇(Necla Karaman),"Erenköy Cami Sok. 2/20 (Erenköy Camii Arkası) Caddebostan, Kadıköy, İstanbul",Yok,2163603818,veri yok,veri yok,40.965569,29.069393
Guzellik-Salonlari-Ve-Merkezleri,Istanbul,Kadikoy,Medusa Güzelli̇k Salonu,"Caddebostan Mah. Bağdat Cad. 356 Kadıköy, İstanbul",Yok,2164115504,veri yok,veri yok,40.963776,29.073653
Guzellik-Salonlari-Ve-Merkezleri,Istanbul,Kadikoy,Unique Esteti̇k Merkezi̇- Sahra Esteti̇k Güzelli̇k Ve Danişmanlik Ltd.Şti̇.,"Bostancı Mah. Bağdat Cad. 471 Suadiye, Kadıköy, İstanbul",Yok,5339254955,veri yok,veri yok,40.957825,29.086573
Guzellik-Salonlari-Ve-Merkezleri,Istanbul,Kadikoy,Sonsuz Mavi̇ Güzelli̇k Ve Masaj Salonu,"Kadıköy, İstanbul",Yok,5324273752,veri yok,veri yok,40.991418,29.023914
Guzellik-Salonlari-Ve-Merkezleri,Istanbul,Kadikoy,Özel Eurosante Poli̇kli̇ni̇ği̇- Intermeda Medi̇kal San. Ve Ti̇c.Ltd.Şti̇.,"Acıbadem Mah. Acıbadem Cad. 109 Aydın Apt. D:2 Kadıköy, İstanbul",Yok,5334289102,veri yok,veri yok,41.005144,29.045077
Guzellik-Salonlari-Ve-Merkezleri,Istanbul,Kadikoy,Özlem Güzelli̇k Salonu(Özlem Yurtsever),"19 Mayıs Mah. İnönü Cad. Sümko Sitesi L3 Blok Kozyatağı, Kadıköy, İstanbul",Yok,2164100179,veri yok,veri yok,40.978041,29.094175
Guzellik-Salonlari-Ve-Merkezleri,Istanbul,Kadikoy,Çakir Güzelli̇k Salonu,"Kayasultan Sok. 72/Ga (Dumankaya Lojmanları İçinde) Kozyatağı, Kadıköy, İstanbul",Yok,2163801256,veri yok,veri yok,40.967538,29.094404
Guzellik-Salonlari-Ve-Merkezleri,Istanbul,Kadikoy,Tarak Kuaför(Erol Demirkaya),"Caferağa Mah. Dr. İhsan Ünlüer Sok. 16 Daire:7 A Blok Kadıköy, İstanbul",Yok,2164183032,veri yok,veri yok,40.985777,29.027525
Guzellik-Salonlari-Ve-Merkezleri,Istanbul,Kadikoy,Sundays Solari̇um- Hg Güzelli̇k Merkezi̇ Turi̇zm İnşaat Otomoti̇v San. Ve Ti̇c.Ltd.Şti̇. (Suna Şahin),"Bostancı Mah. Eminali Paşa Cad. 111 Kadıköy, İstanbul",Yok,2164641713,veri yok,veri yok,40.956976,29.098372
Guzellik-Salonlari-Ve-Merkezleri,Istanbul,Kadikoy,Süreyha Larci̇n Güzelli̇k Merkezi̇(Süreyha Larçin),"Kozyatağı Mah. Hilmi Paşa Cad. 32/2 Kadıköy, İstanbul",Yok,2163734348,veri yok,veri yok,40.972281,29.092472
Guzellik-Salonlari-Ve-Merkezleri,Istanbul,Kadikoy,Bersem Güzelli̇k Salonu,"Fahrettin Kerim Gökay Cad. 148/8 Okurlar Apt. Feneryolu, Kadıköy, İstanbul",Yok,2165673069,veri yok,veri yok,40.983984,29.058041
Guzellik-Salonlari-Ve-Merkezleri,Istanbul,Kadikoy,Meral Güzelli̇k Salonu(Meral Yılmaz),"19 Mayıs Mah. Tevfik Bey Sok. 4/2 Kazasker, Kadıköy, İstanbul",Yok,2164160555,veri yok,veri yok,40.968928,29.084233
Guzellik-Salonlari-Ve-Merkezleri,Istanbul,Kadikoy,Mi̇si̇s Güzelli̇k Salonu(Beyhan Kurtuluş),"Caddebostan Mah. Bağdat Cad. 258 Kadıköy, İstanbul",Yok,2163695489,veri yok,veri yok,40.970148,29.06178
Guzellik-Salonlari-Ve-Merkezleri,Istanbul,Kadikoy,Nursun Güzelli̇k Merkezi̇(Rahime Nursun Emlek),"Caferağa Mah. Moda Cad. 54/B Kadıköy, İstanbul",Yok,2165507361,veri yok,veri yok,40.987116,29.025405
Guzellik-Salonlari-Ve-Merkezleri,Istanbul,Kadikoy,Bora Türküzel,"Acıbadem Mah. Acıbadem Cd Kadıköy, İstanbul",Yok,2165500919,veri yok,veri yok,40.999678,29.038754
Guzellik-Salonlari-Ve-Merkezleri,Istanbul,Kadikoy,Özel Natura Sağlik Poli̇kli̇ni̇ği̇- Natura Güzelli̇k Sağlik Kuyumculuk Gida Ve Turi̇zm Ltd.Şti̇.,"Göztepe Mah. Bağdat Cad. 161 Soylu Apt. K:2 D:4 Kadıköy, İstanbul",Yok,5548806405,veri yok,veri yok,40.976077,29.051354
Guzellik-Salonlari-Ve-Merkezleri,Istanbul,Kadikoy,Adoni̇s Esteti̇k,"Caferağa Mah. Sakız Gülü Sok. 28 Kazdal Apt. K:3 D:6 Kadıköy, İstanbul",Yok,5423309878,veri yok,veri yok,40.987135,29.027865
Guzellik-Salonlari-Ve-Merkezleri,Istanbul,Kadikoy,Sevgi̇ Güzelli̇k Merkezi̇(Sevgi Bozdağ),"Doktor Esat Işık Cad. 20 Moda, Kadıköy, İstanbul",Yok,2163306604,veri yok,veri yok,40.985797,29.025967
Guzellik-Salonlari-Ve-Merkezleri,Istanbul,Kadikoy,Sabi̇ş Güzelli̇k Salonu(Sabiha Aydın),"Göztepe Mah. Prof. Mustafa Reşit Belgesay Sok. 38/A Kadıköy, İstanbul",Yok,5384555856,veri yok,veri yok,40.970976,29.064804
Guzellik-Salonlari-Ve-Merkezleri,Istanbul,Kadikoy,Köşk Lazer- Köşk Lazer Güzelli̇k Ve Esteti̇k Sağlik Ltd.Şti̇.,"Merdivenköy Mah. Fahrettin Kerim Gökay Cad. 231 Gürses Apt. Kadıköy, İstanbul",Yok,5321364066,veri yok,veri yok,40.982422,29.067476
Guzellik-Salonlari-Ve-Merkezleri,Istanbul,Kadikoy,Li̇lyum Güzelli̇k Merkezi̇(Nesringül Aslan),"Bostancı Mah. Bahçelere Giden 1. Yol Sok. 2 Huzur Apt. Kadıköy, İstanbul",Yok,2163731890,veri yok,veri yok,40.957564,29.100904
Guzellik-Salonlari-Ve-Merkezleri,Istanbul,Kadikoy,E Poli̇kli̇ni̇k- Bi̇rli̇kteli̇k Sağlik Hi̇zmetleri̇ Ltd.Şti̇.,"Caddebostan Mah. Bağdat Cad. 271/1 Kadıköy, İstanbul",Yok,2164674226,veri yok,veri yok,40.969287,29.064468
Guzellik-Salonlari-Ve-Merkezleri,Istanbul,Kadikoy,Sunshi̇ne Kuaför Ve Güzelli̇k Salonu,"Sahray-I Cedid Mah. Mengü Sok. 14/C Kadıköy, İstanbul",Yok,2163856281,veri yok,veri yok,40.973486,29.080694
Guzellik-Salonlari-Ve-Merkezleri,Istanbul,Kadikoy,Nevi̇n Güzelli̇k Salonu(Nevin Filiz),"Kozyatağı Mah. Şakacı Sok. 47 Kadıköy, İstanbul",Yok,2164632201,veri yok,veri yok,40.967506,29.089763
Guzellik-Salonlari-Ve-Merkezleri,Istanbul,Kadikoy,Yüksel Güzelli̇k Salonu(Yüksel Salih),"19 Mayıs Mah. Gürsoylu Sok. 37/A Erenköy, Kadıköy, İstanbul",Yok,2163850276,veri yok,veri yok,40.975965,29.085343
Guzellik-Salonlari-Ve-Merkezleri,Istanbul,Kadikoy,Hc Kuaför Ve Güzelli̇k Salonu(Hüsniye Cengiz),"Osmanağa Mah. Yoğurtçu Çayırı Cad. 22 Şahin Apt. (Fenerbahçe Stadı Yakını Yoğurtçu Parkı Karşısı) Kadıköy, İstanbul",Yok,2163363182,veri yok,veri yok,40.994407,29.040343
Guzellik-Salonlari-Ve-Merkezleri,Istanbul,Kadikoy,Eylül Güzelli̇k Salonu(Fatma Deniz Yurtbil),"Caddebostan Mah. Bağdat Cad. 320 Kadıköy, İstanbul",Yok,2163858737,veri yok,veri yok,40.966358,29.068917
Guzellik-Salonlari-Ve-Merkezleri,Istanbul,Kadikoy,Ebruli̇ Güzelli̇k Merkezi̇(Ebru İpekel),"Dr. Kemal Akgüder Cad. Özlem Sok. Bostancı, Kadıköy, İstanbul",Yok,2163620538,veri yok,veri yok,40.962232,29.101026
Guzellik-Salonlari-Ve-Merkezleri,Istanbul,Kartal,Güler Güzelli̇k Salonu(Güler Güzel Özkan),"19 Mayıs Mah. İnönü Cad. 44 Kartal Apt. Dk:1 Kozyatağı, Kadıköy, İstanbul",Cilt Bakımı Ve Lazer Epilasyon Hizmetleri,2163563118,gulerr.guzellik@comail.com,veri yok,40.978687,29.091702
Guzellik-Salonlari-Ve-Merkezleri,Istanbul,Kartal,Tutku Güzelli̇k Salonu(Songül Mocan),"Atalar Mah. Beyazköşk Cad. 11 Kartal, İstanbul",Yok,2163893289,veri yok,veri yok,40.899065,29.17363
Guzellik-Salonlari-Ve-Merkezleri,Istanbul,Kartal,Elay Kli̇ni̇k,"Orhantepe Mah. Saraylar Cad. 80 Tufanoğlu Plaza D:2 Kartal, İstanbul",Estetik Merkezi,5455454323,veri yok,veri yok,40.910749,29.168574
Guzellik-Salonlari-Ve-Merkezleri,Istanbul,Kartal,Aqua Güzelli̇k Merkezi̇,"Kordonboyu Mah. Hamam Sok. 45 Kartal, İstanbul",Yok,2163890123,info@aquaestetikmerkezi.com,http://www.aquaestetikmerkezi.com,40.888846,29.188389
Guzellik-Salonlari-Ve-Merkezleri,Istanbul,Kartal,Özlem Güzelli̇k Salonu(Özlem Beydilli),"Kordonboyu Mah. 23 Nisan Cad. 3 Sıtkıbey İşh. K:3 Kartal, İstanbul",Yok,2163063254,bilgi@ozlemguzelliksalonu.com,http://www.ozlemguzelliksalonu.com,40.888728,29.187845
Guzellik-Salonlari-Ve-Merkezleri,Istanbul,Kartal,Yeşi̇l Yaşam Güzelli̇k Merkezi̇- Mys Ki̇şi̇sel Bakim Ve Sağlik Hi̇zmetleri̇ Turi̇zm Ti̇c.Ltd.Şti̇.,"Orta Mah. Atatürk Cad. Tiryaki Hasanpaşa Sok. 2 D:4 Kartal, İstanbul",Yok,2166710077,veri yok,veri yok,40.914959,29.202121
Guzellik-Salonlari-Ve-Merkezleri,Istanbul,Kartal,Esteti̇k Asya- Konak Taahhüt İnşaat Nakli̇yat Komi̇syonculuk Yayincilik Ti̇c.Ltd.Şti̇.,"Orhantepe Mah. Saraylar Cad. 74 Kartal, İstanbul",Yok,2163525533,veri yok,http://www.estetikasya.com.tr,40.910753,29.167896
Guzellik-Salonlari-Ve-Merkezleri,Istanbul,Kartal,Moneta Güzelli̇k Salonu(Sibel Önoğul),"Yukarı Mah. Üsküdar Cad. 14 Semiha Sumlu Apt. D:2 Kartal, İstanbul",Yok,2163893969,veri yok,veri yok,40.889309,29.183152
Guzellik-Salonlari-Ve-Merkezleri,Istanbul,Kartal,Di̇lek Kara Güzelli̇k Salonu(Dilek Kara),"Kordonboyu Mah. Kumlar Cad. Kartal, İstanbul",Yok,2163897268,veri yok,veri yok,40.898662,29.165869
Guzellik-Salonlari-Ve-Merkezleri,Istanbul,Kartal,My Este Laseri̇um(Hüsnü Altunay),"Yukarı Mah. Üsküdar Cad. Kardeşler İş Merkezi Kartal, İstanbul",Yok,2163535305,veri yok,veri yok,40.889517,29.181605
Guzellik-Salonlari-Ve-Merkezleri,Istanbul,Kartal,She Ve Nes Güzelli̇k Salonu- Özlem Güzelli̇k Salonu Ve Kozmeti̇k Ürünleri̇ Ltd.Şti̇. (Neslihan Benli),"Yeni Mah. Samandıra Cad. 6/4 Yakacık, Kartal, İstanbul",Yok,2164525722,veri yok,veri yok,40.919495,29.225237
Guzellik-Salonlari-Ve-Merkezleri,Istanbul,Kartal,Salon Meç,"Topselvi Mah. Cumhuriyet Cad. 16 Kartal, İstanbul",Yok,2164739350,veri yok,veri yok,40.891258,29.183652
Guzellik-Salonlari-Ve-Merkezleri,Istanbul,Kartal,Başak Güzelli̇k Salonu,"Orta Mah. Genç Osman Cad. 17/A Soğanlık, Kartal, İstanbul",Yok,2164521700,veri yok,veri yok,40.91478,29.19983
Guzellik-Salonlari-Ve-Merkezleri,Istanbul,Kartal,Alex Güzelli̇k Salonu,"Petroliş Mah. Kızılay Blv. 13 Kartal, İstanbul",Yok,5326846911,veri yok,veri yok,40.889974,29.180944
Guzellik-Salonlari-Ve-Merkezleri,Istanbul,Kartal,Koçak Güzelli̇k Salonu(Göksu Güneş),"Yukarı Mah. Belediye Cad. 23 Dk:5 Kartal, İstanbul",Yok,5444619539,veri yok,veri yok,40.89171,29.182999
Guzellik-Salonlari-Ve-Merkezleri,Istanbul,Kartal,Li̇la Güzelli̇k Merkezi(Cevahir Alkoç),"Atalar Mah. Atalar Cad. Kartal, İstanbul",Yok,2163879048,veri yok,veri yok,40.903931,29.170881
Guzellik-Salonlari-Ve-Merkezleri,Istanbul,Kartal,Tuana Güzelli̇k Merkezi̇(Hasan Birol Tekin),"Yukarı Mah. Üsküdar Cad. 9/25 Kartal, İstanbul",Yok,2164731328,veri yok,veri yok,40.888836,29.183721
Guzellik-Salonlari-Ve-Merkezleri,Istanbul,Kartal,Semra Güzelli̇k Salonu(Semra Kars),"Karlıktepe Mah. İnönü Cad. 73/A Kartal, İstanbul",Yok,2165171342,veri yok,veri yok,40.901834,29.185201
Guzellik-Salonlari-Ve-Merkezleri,Istanbul,Kartal,Sera Güzelli̇k Merkezi̇,"Petroliş Mah. Üsküdar Cad. 36 Akuç Apt. D:1 Kartal, İstanbul",Yok,5305514711,veri yok,veri yok,40.889764,29.180648
Guzellik-Salonlari-Ve-Merkezleri,Istanbul,Kucukcekmece,Koza Güzelli̇k Salonu(Yasemin Yönel),"Yeni Mahalle Mah. Mimar Sinan Cad. Şehit Şenol Ergün Sok. 27 Küçükçekmece, İstanbul",Yok,2126242472,veri yok,veri yok,40.995435,28.779217
Guzellik-Salonlari-Ve-Merkezleri,Istanbul,Kucukcekmece,Erva Esteti̇k Ve Güzelli̇k Merkezi̇,"Tevfik Bey Mah. Halkalı Cad. 112 Nazlı İş Mrk. K:1 Sefaköy, Küçükçekmece, İstanbul",Estetik Merkezleri,2124262283,veri yok,veri yok,41.004905,28.797487
Guzellik-Salonlari-Ve-Merkezleri,Istanbul,Kucukcekmece,Di̇va Form Armoni̇ Park Avm Şubesi̇(Pirihan Demir),"Tevfik Bey Mah. Halkalı Cad. 130 Armoni Park Avm Küçükçekmece, İstanbul",Yok,2125989722,veri yok,http://www.divaform.com.tr,41.006907,28.797362
Guzellik-Salonlari-Ve-Merkezleri,Istanbul,Kucukcekmece,Este Queen Güzelli̇k Merkezi̇(Seher Öztürk),"Cennet Mah. Hürriyet Cad. 23 Gönül Apt. Küçükçekmece, İstanbul",Yok,2125400118,info@estequeen.com,http://www.estequeen.com,40.987277,28.78093
Guzellik-Salonlari-Ve-Merkezleri,Istanbul,Kucukcekmece,Tuğba Yaman Bakim Ve Güzelli̇k Merkezi̇,"Cennet Mah. Hürriyet Cad. Zafer Sok. 20 K:1 Küçükçekmece, İstanbul",Yok,2128234257,info@tugbayamanguzellik.com,http://tugbayamanguzellik.com,40.990086,28.780419
Guzellik-Salonlari-Ve-Merkezleri,Istanbul,Kucukcekmece,Di̇va Form Arena Park Avm Şubesi̇- Meli̇ssa Güzelli̇k Salonu Teksti̇l San. Ve Ti̇c.Ltd.Şti̇.,"Atakent Mah. Çiçekli Vadi Cad. 38/B Arena Park Avm Küçükçekmece, İstanbul",Yok,2124957197,veri yok,http://www.divaform.com.tr,41.054876,28.792132
Guzellik-Salonlari-Ve-Merkezleri,Istanbul,Kucukcekmece,Gözde Esteti̇k,"Halkalı Merkez Mah. Bilim Sok. 6/G Cadde 24 Rezidans Küçükçekmece, İstanbul",Yok,2128128088,veri yok,veri yok,41.036426,28.785974
Guzellik-Salonlari-Ve-Merkezleri,Istanbul,Kucukcekmece,Elenor Güzelli̇k Salonu(Pınar Çelen),"Atatürk Mah. Kartopu Sok. 1 D:6 Küçükçekmece, İstanbul",Yok,2124720208,veri yok,veri yok,41.048182,28.80072
Guzellik-Salonlari-Ve-Merkezleri,Istanbul,Kucukcekmece,Prohand Güzelli̇k Salonu(Hülya Gülbeyaz),"Cennet Mah. Hürriyet Cad. 45 B Blok K:1 D:6 Küçükçekmece, İstanbul",Yok,2125806065,hulya-gulbeyaz@hotmail.com,veri yok,40.988993,28.780304
